{
  "$schema": "../../../../src/Oxygen/Cooker/Import/Schemas/oxygen.material-descriptor.schema.json",
  "name": "Rock030",
  "domain": "opaque",
  "alpha_mode": "opaque",
  "orm_policy": "auto",
  "parameters": {
    "base_color": [1, 1, 1, 1],
    "metalness": 0,
    "roughness": 1,
    "normal_scale": 1,
    "ambient_occlusion": 1
  },
  "textures": {
    "base_color": {
      "virtual_path": "/.cooked/Resources/Textures/Rock030_base_color.otex"
    },
    "normal": {
      "virtual_path": "/.cooked/Resources/Textures/Rock030_normal.otex"
    },
    "roughness": {
      "virtual_path": "/.cooked/Resources/Textures/Rock030_roughness.otex"
    }
  }
}
